{
  "frameworkAddress": "anatomy.m06",
  "title": "Collections",
  "tag": "Module 06 · Collections: sort & filter",
  "status": "published",
  "scan": [
    "<strong>What you will learn:</strong> the Strategy pattern applied to sort and filter — how to manage multiple sort/filter algorithms without if-else chains",
    "<strong>Why it matters:</strong> every content-heavy AEM site has a collection component — how it is sorted and filtered determines performance, testability, and author control",
    "a sort strategy is a pure function that takes two items and returns a comparison value — any sort that does anything else is wrong",
    "filter composition (AND vs OR logic) is a business rule not an implementation detail — get it in writing before coding"
  ],
  "sections": [
    {
      "id": "anatomy.m06.opener",
      "title": "Collections: sort & filter",
      "order": 0,
      "blocks": [
        {
          "type": "chapter-open",
          "page": 1,
          "drop": "M",
          "html": "oment you have a <em>group</em> of things, you need two operations forever: <strong>sort</strong> (put them in order) and <strong>filter</strong> (keep only what matters). The mistake is scattering that logic across the views that consume the data."
        }
      ]
    },
    {
      "id": "anatomy.m06.manager",
      "title": "Put sort and filter behind a manager",
      "order": 1,
      "blocks": [
        {
          "type": "heading",
          "page": 2,
          "html": "Collections: sort &amp; filter"
        },
        {
          "type": "diagram",
          "page": 2,
          "render": "flow",
          "steps": [
            { "label": "collection" },
            { "label": "manage", "variant": "ochre" },
            { "label": "sort" },
            { "label": "filter" }
          ]
        },
        {
          "type": "prose",
          "page": 2,
          "html": "Put sorting and filtering behind a single <strong>manager</strong>. Views ask it for the slice they need; they never re-implement the rules. Swap a sort comparator or a filter predicate in one place — that's the Strategy pattern earning its keep."
        }
      ]
    },
    {
      "id": "anatomy.m06.strategy",
      "title": "Strategy registries and the sort-location decision",
      "order": 2,
      "blocks": [
        {
          "type": "callout",
          "page": 3,
          "variant": "tip",
          "html": "DEPT® field pattern — implement sort and filter as separate strategy registries. A filter registry (keyed by filter name, value: predicate function) plus a sort registry (keyed by sort name, value: comparator function) composes to a full collection management system with zero hard-coded combinations. Adding a new sort is adding one function to one object."
        },
        {
          "type": "callout",
          "page": 3,
          "variant": "pitfall",
          "html": "Sorting on the client after a server-side paginated response. The sort applies to the current page only; users see inconsistent ordering as they paginate. This is not a bug that appears in testing — it appears when the collection has more than one page and a user notices the anomaly. Decide sort location (client or server) before API design, not after."
        }
      ]
    },
    {
      "id": "anatomy.m06.review",
      "title": "Architect's Review · Collections",
      "order": 3,
      "blocks": [
        {
          "type": "architects-review",
          "page": 4,
          "label": "Architect's Review · Collections",
          "items": [
            "Where is sort logic — duplicated, or behind a manager?",
            "Where is filter logic — the same?",
            "Can comparators and predicates be swapped without touching consumers?",
            "Is pagination part of the collection, or bolted on at the view?"
          ]
        }
      ]
    }
  ]
}
