{
  "frameworkAddress": "code.e",
  "title": "Engineering",
  "tag": "Business intent becomes working software",
  "status": "published",
  "scan": [
    "<strong>What this letter is:</strong> The E of CODE — the engineering domain, where business intent is transformed into working software",
    "<strong>Why it matters:</strong> Unlike the other three CODE letters, Engineering doesn't just carry questions — it carries its own five-layer framework, CODER",
    "Engineering telescopes: zoom into the E of CODE and a second framework unfolds — C · O · D · E · R — five letters for keeping the build itself honest",
    "Deliverables at this level: technical architecture, the CODER plan, and working software",
    "This chapter is the bridge — it opens into CODER, where Code, Optimization &amp; Quality, Deployment, External Integrations, and Release Management each get their own deep-dive"
  ],
  "sections": [
    {
      "id": "code.e.opener",
      "title": "E · Engineering",
      "order": 0,
      "blocks": [
        { "type": "chapter-open", "page": 1, "drop": "E", "html": "ngineering transforms business intent into working software. Unlike the other three, this letter doesn't just have questions — it has its own five-layer framework. Zoom in below." },
        { "type": "chips", "page": 1, "items": [
          "Technical Architecture",
          "The CODER plan ↓",
          "Working Software"
        ] }
      ]
    }
  ]
}
