{
  "frameworkAddress": "anatomy.m05",
  "title": "State",
  "tag": "Module 05 · New",
  "status": "published",
  "scan": [
    "<strong>What you will learn:</strong> What state is, the equation that governs every modern UI framework, and how to design a state model that makes bugs auditable rather than ephemeral",
    "<strong>Why it matters:</strong> State bugs are the hardest to reproduce because they are temporal — the state at the time of the bug is gone — a disciplined state model makes the system auditable",
    "Current State + Event = New State — every framework from Redux to Angular Signals is an elaboration of that equation",
    "The single source of truth is not a performance optimisation but a correctness constraint — duplicate state always diverges",
    "UI state and application state are different concerns and must be stored in different places — conflating them is the root cause of most \"the UI doesn't match the data\" bugs"
  ],
  "sections": [
    {
      "id": "anatomy.m05.opener",
      "title": "State",
      "order": 0,
      "blocks": [
        {
          "type": "chapter-open",
          "page": 1,
          "drop": "E",
          "html": "very modern application reduces to one equation. It fits on a napkin:"
        },
        {
          "type": "diagram",
          "page": 1,
          "render": "ascii",
          "title": "State machine",
          "source": "  [Idle] ──load──▶ [Loading] ──success──▶ [Ready]\n                       │\n                     error\n                       │\n                       ▼\n                    [Error] ──retry──▶ [Loading]"
        },
        {
          "type": "callout",
          "page": 1,
          "variant": "why",
          "html": "State machines pay off at scale. A component with 4 boolean flags (<code>isLoading</code>, <code>isError</code>, <code>isEmpty</code>, <code>isSuccess</code>) has 16 possible states, most of which are invalid and untested. A state machine with 4 named states (<code>idle</code>, <code>loading</code>, <code>ready</code>, <code>error</code>) has exactly 4 — each reachable only via defined transitions. Invalid states become impossible."
        },
        {
          "type": "callout",
          "page": 1,
          "variant": "pitfall",
          "html": "Storing the result of a filter operation in state. When the source array updates, the filtered result is stale. Symptom: a user clears a filter and sees old results until the next full fetch. Fix: store the source array and the filter parameters; recompute the filtered view on every render."
        }
      ]
    },
    {
      "id": "anatomy.m05.equation",
      "title": "State — what the system remembers between moments",
      "order": 1,
      "blocks": [
        {
          "type": "heading",
          "page": 2,
          "html": "State — what the system remembers between moments"
        },
        {
          "type": "lead",
          "page": 2,
          "html": "Every modern application reduces to one equation. It fits on a napkin:"
        },
        {
          "type": "diagram",
          "page": 2,
          "render": "ascii",
          "title": "The equation",
          "source": "Current State  +  Event  =  New State"
        },
        {
          "type": "prose",
          "page": 2,
          "html": "That equation is why React, Redux, MobX, Zustand, Angular Signals — every modern frontend framework — exists. They are all elaborations of three words: <strong>state plus event</strong>. Get the equation right and every framework becomes legible at a glance."
        }
      ]
    },
    {
      "id": "anatomy.m05.kinds",
      "title": "What state actually is",
      "order": 2,
      "blocks": [
        {
          "type": "heading",
          "page": 3,
          "html": "What state actually is"
        },
        {
          "type": "prose",
          "page": 3,
          "html": "State is everything the system has to remember between moments. Variables hold individual values; state is the <em>aggregate</em> that defines what the user is currently looking at, who they are, where they are in a flow, and what the system is doing on their behalf."
        },
        {
          "type": "notes",
          "page": 3,
          "items": [
            "<b>Authentication state</b> — who is logged in and what they can see.",
            "<b>Application state</b> — the overall mode the app is in (loading, ready, error, offline).",
            "<b>Workflow state</b> — where the user is in a multi-step process.",
            "<b>Page state</b> — what's on screen right now, what's selected, what's open.",
            "<b>Domain state</b> — cart contents, search results, the current document."
          ]
        }
      ]
    },
    {
      "id": "anatomy.m05.truth",
      "title": "The single source of truth",
      "order": 3,
      "blocks": [
        {
          "type": "heading",
          "page": 4,
          "html": "The single source of truth"
        },
        {
          "type": "prose",
          "page": 4,
          "html": "State must live in <em>one</em> place. Render reads from it. Biz writes to it. API hydrates it. The moment two places hold the \"same\" piece of state, they drift — and the rest of the project is spent chasing why one screen shows old data."
        },
        {
          "type": "quote",
          "page": 4,
          "html": "If you can't answer \"where does this value live?\" in one breath, your state is fragmented."
        },
        {
          "type": "prose",
          "page": 4,
          "html": "This is why Stalwart (Module 09 onwards) treats <code>state.js</code> as a first-class file — distinct from <code>model.js</code>. The model owns the <em>shape</em> of an entity; state owns the <em>current value</em> of that entity in the running app."
        }
      ]
    },
    {
      "id": "anatomy.m05.review",
      "title": "Architect's Review",
      "order": 4,
      "blocks": [
        {
          "type": "architects-review",
          "page": 5,
          "label": "Architect's Review · State",
          "items": [
            "Who owns each piece of state?",
            "What events change it?",
            "What persists it (memory, localStorage, server)?",
            "What invalidates it (logout, refresh, timeout)?",
            "Is there a single source of truth, or are copies drifting?"
          ]
        }
      ]
    }
  ]
}
