{
  "frameworkAddress": "anatomy.m02b",
  "title": "Components · The Unit of Reuse",
  "tag": "Module 02b · Companion to Primitives",
  "status": "published",
  "scan": [
    "<strong>What you will learn:</strong> A component is a self-contained UI unit with four architectural dimensions — State, Events, Rendering, and Configuration",
    "<strong>Why it matters:</strong> The presentational vs container split is the single most impactful structural decision at component design time — it determines testability, reusability, and AI-delegation safety",
    "Components that mix presentation with data-fetching cannot be tested in isolation, reused across contexts, or safely delegated to an AI agent",
    "Configuration is the escape valve that keeps a component reusable — anything that varies between placements belongs in config, not code"
  ],
  "sections": [
    {
      "id": "anatomy.m02b.opener",
      "title": "Components — the unit of reuse",
      "order": 0,
      "blocks": [
        {
          "type": "chapter-open",
          "page": 1,
          "drop": "M",
          "html": "odels represent entities. Components represent <em>self-contained pieces of the UI</em> — and in modern frontend development they are both the unit of reuse and the unit of contract between teams."
        },
        {
          "type": "diagram",
          "page": 1,
          "render": "ascii",
          "source": "         Config\n           │\n           ▼\n┌──────────────────────────────┐\n│  Container                   │\n│                              │\n│  State ──►┌────────────────┐ │\n│           │ Presentational │ │\n│           │                │─┼──► Events\n│           └────────────────┘ │\n│                  │           │\n└──────────────────┼───────────┘\n                   ▼\n                Render"
        },
        {
          "type": "callout",
          "page": 1,
          "variant": "tip",
          "html": "DEPT® field pattern: define the component's config schema (TypeScript interface or JSON Schema) before writing any logic. The schema is the contract; the code is the implementation. A component whose config schema cannot be written in 10 minutes has not been designed yet."
        },
        {
          "type": "callout",
          "page": 1,
          "variant": "pitfall",
          "html": "Components with more than one network call in their lifecycle are almost always container components written as presentational ones. The symptom: the component is not reusable because it is hardwired to a specific API endpoint. Extract the data layer into a container."
        }
      ]
    },
    {
      "id": "anatomy.m02b.dimensions",
      "title": "What lives inside a component",
      "order": 1,
      "blocks": [
        {
          "type": "heading",
          "page": 2,
          "html": "What lives inside a component"
        },
        {
          "type": "prose",
          "page": 2,
          "html": "A well-formed component is, in miniature, what Stalwart enforces at feature scale: it owns its <strong>state</strong>, declares its <strong>events</strong>, encapsulates its <strong>rendering</strong>, and accepts <strong>configuration</strong> from outside. That is why component thinking translates so cleanly into AI-generated code — each component is a tiny Stalwart."
        },
        {
          "type": "cardgrid",
          "page": 2,
          "columns": 4,
          "cards": [
            {
              "eyebrow": "Inside",
              "title": "State",
              "body": "What the component remembers between interactions — open/closed, selected value, loading."
            },
            {
              "eyebrow": "Outward",
              "title": "Events",
              "body": "What it emits when something happens — <code>change</code>, <code>submit</code>, <code>select</code>. Its public action surface."
            },
            {
              "eyebrow": "Visible",
              "title": "Rendering",
              "body": "How it draws itself given its state and props. The visual contract."
            },
            {
              "eyebrow": "Inward",
              "title": "Configuration",
              "body": "Props in, slots/children supplied. How the parent customises it."
            }
          ]
        }
      ]
    },
    {
      "id": "anatomy.m02b.kinds",
      "title": "Two kinds of components",
      "order": 2,
      "blocks": [
        {
          "type": "heading",
          "page": 3,
          "html": "Two kinds of components"
        },
        {
          "type": "diagram",
          "page": 3,
          "render": "versus",
          "columns": [
            {
              "label": "Presentational",
              "body": "Stateless or near-stateless. Props in, DOM out. A <em>Button</em>, a <em>Card</em>, a <em>Badge</em>. The most reusable layer of a design system."
            },
            {
              "label": "Container",
              "body": "Holds state, talks to APIs, coordinates child components. A <em>SearchBox</em>, a <em>Dashboard</em>, a <em>CheckoutFlow</em>. Closer to a feature than a primitive."
            }
          ]
        },
        {
          "type": "prose",
          "page": 3,
          "html": "The split matters: presentational components are <em>shared across features</em>; containers are <em>features themselves</em>. The Stalwart file structure (CODER's <strong>C</strong>) is essentially the anatomy of a container component grown to feature scale."
        }
      ]
    },
    {
      "id": "anatomy.m02b.review",
      "title": "Architect's Review · Components",
      "order": 3,
      "blocks": [
        {
          "type": "architects-review",
          "page": 4,
          "label": "Architect's Review · Components",
          "items": [
            "Is there a component inventory, with owners?",
            "Are component contracts (props, events, slots) documented?",
            "Is the presentational vs container split clear in the codebase?",
            "What's the test strategy per component type?",
            "Is there a shared component library, and who governs it?"
          ]
        }
      ]
    }
  ]
}
